{
  "schema_version": "2026-05-21",
  "name": "example-langgraph-connector",
  "version": "1.0.0",
  "framework": "LangGraph",
  "languages": ["python", "typescript"],
  "enforcement_modes": ["gateway_mediated", "connector_verified"],
  "context_propagation": {
    "authorization": true,
    "traceparent": true,
    "tracestate": true,
    "baggage": true
  },
  "audit": {
    "emits_action_result": true,
    "labels_enforcement_mode": true
  },
  "conformance": {
    "fixtures": ["trace-context.headers.valid.json", "jwt-claims.resource.valid.json"],
    "tested_with_caracal": "0.1.2"
  }
}
